{
  "schema": "toolhub.extension/v2",
  "id": "toolhub.builtin.tasks",
  "name": "任务管理",
  "version": "1.0.0",
  "description": "查看运行任务、执行结果和活动记录。",
  "author": "ToolHub",
  "license": "MIT",
  "platforms": [
    "windows",
    "macos",
    "linux"
  ],
  "min_toolhub_version": "0.3.0-beta.3",
  "host_module": "tasks",
  "navigation": {
    "label": "任务",
    "icon": "📋",
    "order": 80
  }
}
