{
  "schema": "toolhub.extension/v2",
  "id": "toolhub.builtin.artifacts",
  "name": "产物管理",
  "version": "1.0.0",
  "description": "管理任务产物，按用户规则回收到系统回收站。",
  "author": "ToolHub",
  "license": "MIT",
  "platforms": [
    "windows",
    "macos",
    "linux"
  ],
  "min_toolhub_version": "0.3.0-beta.3",
  "host_module": "artifacts",
  "navigation": {
    "label": "产物",
    "icon": "📦",
    "order": 30
  }
}
