{
  "schema": "toolhub.extension/v2",
  "id": "toolhub.builtin.envs",
  "name": "环境管理",
  "version": "1.0.0",
  "description": "查看本机环境、关联工具和重复安装。",
  "author": "ToolHub",
  "license": "MIT",
  "platforms": [
    "windows",
    "macos",
    "linux"
  ],
  "min_toolhub_version": "0.3.0-beta.3",
  "host_module": "envs",
  "navigation": {
    "label": "环境",
    "icon": "🧩",
    "order": 50
  }
}
