{
  "schema": "toolhub.extension/v2",
  "id": "toolhub.builtin.skills",
  "name": "Skill 库管理",
  "version": "1.0.0",
  "description": "收录和检索跨智能体复用的通用流程。",
  "author": "ToolHub",
  "license": "MIT",
  "platforms": [
    "windows",
    "macos",
    "linux"
  ],
  "min_toolhub_version": "0.3.0-beta.3",
  "host_module": "skills",
  "navigation": {
    "label": "Skill 库",
    "icon": "📚",
    "order": 60
  }
}
