{
  "schema": "toolhub.extension/v2",
  "id": "toolhub.builtin.market",
  "name": "市场管理",
  "version": "1.0.0",
  "description": "浏览、导入和分享通用能力包。",
  "author": "ToolHub",
  "license": "MIT",
  "platforms": [
    "windows",
    "macos",
    "linux"
  ],
  "min_toolhub_version": "0.3.0-beta.3",
  "host_module": "market",
  "navigation": {
    "label": "市场",
    "icon": "🛍️",
    "order": 70
  }
}
