{
  "schema": "toolhub.extension/v2",
  "id": "toolhub.builtin.programs",
  "name": "程序管理",
  "version": "1.0.0",
  "description": "登记启动入口，查看 Agent 提案并启动用户程序。",
  "author": "ToolHub",
  "license": "MIT",
  "platforms": [
    "windows",
    "macos",
    "linux"
  ],
  "min_toolhub_version": "0.3.0-beta.3",
  "host_module": "programs",
  "navigation": {
    "label": "程序",
    "icon": "🚀",
    "order": 20
  }
}
